name,phone,address,website,description
STARLITE RECOVERY CENTER ,844-650-1390,,,"StarliteRecovery.com Provides comprehensive, individualized continuum of care for chemically dependent persons and/or their family members who have been affected by the diseases of alcoholism and/or drug addiction. Services include Residential, Intensive Outpatient, Partial Hospitalization, and Detox. Call for free insur- ance verification."
TEXAS FAMILY VOICE NETWORK,,,,txfvn.org Peer Support for Families of Children and Young Adults with Behavioral Health Challenges
AGENCY,,,,
SHOUT OUT,,,,
NAMI - SAN ANTONIO,210-734-3349,"6800 Park Ten Blvd., Suite 248 E",,"National Alliance on Mental Illness NAMI is the National Alliance on Mental Illness, the nation’s largest grassroots mental health or- ganization dedicated to building better lives for the millions of Americans affected by mental ill- ness. Support Groups Free, confidential peer support groups discuss- ing mental health to gain insight from the chal- lenges and successes of others facing similar ex- periences. Separate groups are available for adults (18+) with mental health conditions and their families. NAMI on Campus Student-led clubs that support fellow stu- dents raise mental health awareness, educate the campus community and promote services and supports. Pathways to Hope Conference Free, community-wide conference focused on reducing stigma, improving mental health sup- port, providing education and resources Education Free educational programs to discuss mental health experiences, effective tools for recovery, common support needs for individuals experi- encing mental illness and their families. Stigma Reduction Free presentations can be scheduled that in- form and educate viewers of the warning signs and misconceptions of mental health condi- tions. Ending the Silence In Our Own Voice NAMIWalk namiwalks.org Annual mental health awareness 5k fundraiser encouraging Mental Health for All."
EMERGENCY SHELTERS,,,,Temporary facility that provides immediate shelter for individuals in crisis with nowhere to sleep.
BETHANY UNITED METHODIST CHURCH,210-655-5473,4102 Eisenhower Rd.,,"bethanysa.org Winter overflow shelter services (32˚ or below), 5:00 p.m.-8:00 a.m., laundry, shower, meal"
THE CHILDREN’S SHELTER,210-212-2500,"Emergency Shelter and safe haven for children (up to age 12) who have been removed from their homes due to traumatic experiences such as abuse, neglect, and/or abandonment.",,childrensshelter.org 2939 West Woodlawn
FAMILY VIOLENCE PREVENTION SERVICES,210-930-3669,7911 Broadway,,"fvps.org Offers residential and non-residential clients shelter, transitional housing, counseling for adults, children, families, and legal services. These services help individuals and families recovery from the pain and longer-term effects of domestic violence."
HAVEN FOR HOPE	,210-220-2100,1 Haven For Hope Way,,havenforhope.org Transformational campus that provides a system of care for individu- als and families experiencing homelessness in Bexar County. All of Haven for Hope programs provide indoor sleeping and access to housing and sustainability services. Individuals experiencing home- lessness can be enrolled into one of Haven’s various programs on a first-come-first-served basis and dependent on space availability. In- take hours are Monday-Friday: 7:00 a.m.-3:00 p.m.
"ROY MAAS’ YOUTH ALTERNATIVES, INC.",210-340-8077,3103 West Ave.,,"rmya.org Creates brighter futures for children in crisis by promoting individual success and healthy relationships in a safe, healing environment, giv- ing children and families the tools to end the cycle of abuse."
THE BRIDGE 210-340-7933,,"Children (ages 5-17) needing a safe place to stay for a short time receive 24-hour care while a more permanent placement is determined. Emergency shelter services are provided for trafficked, runa- way, homeless, foster youth and children transition- ing from juvenile probation. Call prior to arriving.",,
SALVATION ARMY,210-352-2000,,,salvationarmysanantonio.org
DAVE COY SHELTER FOR MEN,210-226-2291,226 Nolan St.,,ST. PETER – ST. JOSEPH CHILDREN’S HOME stpjhome.org 210-533-1203 919 Mission Rd. Short-term emergency shelter for children (ages birth to 17) who are victims of abuse or neglect and are under the protection of Child Protective Ser- vices.
STRONG FOUNDATION MINISTRIES,210-641-4357,414 N. Hackberry St.,,strongfoundation.org Emergency and temporary housing for homeless families with children Emergency shelter and transitional housing oppor- tunities for men (ages 18+) experiencing chronic homelessness and/or lack a stable housing environ- ment. Participants receive three meals daily and work with a case manager to identify and coordi- nate available educational and career development opportunities.
EMERGENCY FAMILY SHELTER,210-352-2046,,,521 W. Elmira
SAN ANTONIO RESCUE MISSION,210-222-9736,,,sarescuemission.org 907 E. Quincy Faith-based organization offering dormitory shelter to homeless men (ages 18+)
SETON HOME,210-533-3504,1115 Mission Rd.,,"setonhomesa.org Emergency shelter for pregnant and parenting teen mothers and their children in order to break the cy- cle of abuse and poverty by providing a caring home, education, and support services."
HOUSING & RENTAL ASSISTANCE,,,,General information and financial assistance related to housing.
ALAMO COMMUNITY GROUP,210-731-8030,"4606 Centerview Drive, Suite 170",,"alamocommunitygroup.org Housing organization offering affordable housing that promotes resident education, self-sufficiency, leadership and volunteerism"
HOUSE OUR HEROES PROGRAM 210-699-9074,,,,Affordable housing and extensive supportive ser- vices for homeless and at-risk veteran families.
ENDEAVORS,210-431-6466,6363 De Zavala Rd. (Headquarters),,"endeavors.org Supportive housing, case management, profession- al counseling, life skills training, and employment opportunities for chronically homeless adults with disabilities and their children throughout Texas. 22"
FAIR WEATHER LODGE 210-840-6437 (SARAH),,Permanent supportive housing serving a vulnerable population in San Antonio and Bexar County of sin- gle mothers with disabilities and their children who have experienced chronic homelessness. Call-in assessment hours are Mondays: 9:00 a.m.-10:45 a.m.,,
HABITAT FOR HUMANITY,210-223-5203,,,habitatsa.org 311 Probandt Habitat is a nonprofit housing organization working with local families in need of affordable homes.
HAVEN FOR HOPE	,210-220-2100,1 Haven For Hope Way,,havenforhope.org Transformational campus that provides a system of care for individuals and families experiencing homelessness in Bexar County. All of Haven for Hope programs provide indoor sleeping and ac- cess to housing and sustainability services. Individu- als experiencing homelessness can be enrolled into one of Haven’s various programs on a first-come- first-served basis (dependent on space availability). Intake hours are Monday-Friday: 7:00 a.m.-3:00 p.m.
HOUSING AUTHORITY OF BEXAR COUNTY,210-225-0071,1954 E. Houston St.,,habctx.org Aim to provide rental assistance to income-eligible households and to provide improved living condi- tions in Bexar County
INMAN CHRISTIAN CENTER,210-222-9641,1214 Colima Street,,"inmancenter.org Neighborhood-based community center serving the needs of low-income individuals and families in the inner city of San Antonio. Inman provides child- care, social services, education, recreation, and emergency food assistance as well as housing for individuals who are elderly and/or disabled."
MERCED HOUSING TEXAS,210-281-0234,120 W. Mistletoe Ave.,,"mercedhousingtexas.org Dedicated to creating healthy communities by providing quality, affordable housing with support- ive services for low-income individuals, families, and older adults where opportunities for education, em- ployment, financial literacy and health are en- hanced and encouraged."
OPPORTUNITY HOME SAN ANTONIO,210-477-6000,,,"homesa.org 818 S. Flores Provides quality, affordable housing and builds sus- tainable, thriving communities. Previously San Anto- nio Housing Authority."
PROSPERA HOUSING COMMUNITY SERVICES,210-821-4300,3419 Nacogdoches Rd.,,"prosperahcs.org Empowering families by providing safe, high- quality, affordable housing with support services. Our supportive housing provides a starting point for pursuing goals, fulfilling dreams, restoring spirit, and building self-endurance."
SAMMINISTRIES,210-340-0302,,,"samm.org 1919 NW Loop 410, Suite 100"
RAPID RE-HOUSING 210-321-5620,,,,Financial assistance is provided to homeless indi- viduals and families for up to 3 months along with 12 months of case management.
PERMANENT SUPPORTIVE HOUSING 210-321-5683,,,,Assists families with whom one member of the fami- ly has a disability empowering them to live as inde- pendently as possible
SAN ANTONIO ALTERNATIVE HOUSING CORP.,,,,"saahc.org Nonprofit organization that provides housing and support services for low and moderate-income communities in Texas SOUTH ALAMO REGIONAL ALLIANCE FOR THE HOMELESS (SARAH) sarahomeless.org/resources Homelink is San Antonio and Bexar County’s local Coordinated Entry System – a uniform, community- wide approach to connect persons who are literally homeless or at imminent risk of homelessness to housing resources."
TEMPORARY & TRANSITIONAL,,,,Temporary housing with supportive services that help stabilize and educate individuals experiencing homelessness.
BAPTIST CHILD & FAMILY SERVICES,210-733-7932,,,"discoverbcfs.net/sanantonio 4346 NW Loop 410 Transitional Center that offer case management, counseling, sheltering, and life skills training to at- risk young adults aging out of the foster care sys- tem."
FAMILY VIOLENCE PREVENTION SERVICES,210-930-3669,7911 Broadway,,"fvps.org Offers residential and non-residential clients shel- ter, transitional housing, counseling for adults, chil- dren, families, and legal services. These services help individuals and families recovery from the pain and longer-term effects of domestic violence."
GEORGE GERVIN YOUTH CENTER:,,,,
BASIC CENTER,210-568-8800,6944 South Sunbelt Drive,,"Pregnant, homeless, and/or runaway individuals (ages 13-17) looking to continue their education in a safe and supportive environment. The Basic Pro- gram provides therapeutic and supportive services and acts as a short- and long-term residential care facility to those whose needs are not adequately met in their current family structure or other shel- ters."
HAVEN FOR HOPE	,210-220-2100,1 Haven For Hope Way,,havenforhope.org Transformational campus providing a system of care for individuals and families experiencing homelessness in Bexar County. Shelter is provided while clients work to address issues that have led to their homelessness. Program enrollment is on a first -come-first-served basis. Intake hours are Monday- Friday: 7:00 a.m.-3:00 p.m.	24
MAGDALENA HOUSE,210-561-0505,,,"maghouse.org Neighborhood of transitional homes in San Antonio that serves mothers and their children who have fled dangerous and abusive lives. Utilizing a dual- generation approach, we provide safe shelter, basic needs, educational programming, and therapeutic services."
"ROY MAAS’ YOUTH ALTERNATIVES, INC.",210-340-8077,3103 West Ave.,,"rmya.org Creates brighter futures for children in crisis by pro- moting individual success and healthy relationships in a safe, healing environment, giving children and families the tools to end the cycle of abuse."
TURNINGPOINT 210-349-3610,,"Former foster care youth and homeless community youth (ages 18-24) live independently in a home with roommates. They receive professional case management, weekly counseling, job and life skills, educational assistance, and resource referrals, to help them meet their goals and leave the program ready to become productive members of our com- munity.",,
SALVATION ARMY,210-352-2000,,,salvationarmysanantonio.org
ADULT REHABILITATION CENTER 210-223-6877,,,,"Provides assistance for adults who have lost the ability to cope with their problems and provide for themselves. Each center offers residential housing, work, and group and individual therapy, all in a clean, wholesome environment. The services re- ceived prepare participants to re-enter society and return to gainful employment."
DAVE COY SHELTER FOR MEN 210-226-2291,,226 Nolan St.,,Emergency shelter and transitional housing oppor- tunities for men (ages 18+) experiencing chronic homelessness and/or lack a stable housing environ- ment. Participants receive three meals daily and work with a case manager to identify and coordi- nate available educational and career development opportunities.
SAMMINISTRIES,210-979-6188,,,"samm.org 1919 NW Loop 410, Suite 100 The Transitional Living and Learning Center is a 40- family home that provides housing, support, and resources to families who show a commitment to gaining self-sufficiency as they work to overcome homelessness."
STRONG FOUNDATION MINISTRIES,210-641-4357,414 N. Hackberry St.,,strongfoundation.org Emergency and temporary housing for homeless families with children
VISITATION HOUSE MINISTRIES,210-735-6910,830 W. Mulberry Ave.,,"visitationhouseministries.org Transitional housing for women and children (2- year program), call for appointment"
YOUTH CENTER OF TEXAS,210-417-5077,,,"youthcenteroftexas.org (24-Hour Hotline) 3730 East IH-10, Suite B Transitional living program for female survivors of child sex trafficking and sexual exploitation (ages 18-22)"
UTILITY ASSISTANCE,,,,Temporary financial assistance to reduce the costs associated with home utilities
CHRISTIAN ASSISTANCE MINISTRY,210-223-4099,110 McCullough Ave,,"christianassistanceministry.org Financial assistance for utilities provided to families with proof of resi- dence. Application, ID & Social Security card required. CAM Downtown CAM Northwest 210-697-5771 5084 DeZavala"
ELLA AUSTIN COMMUNITY CENTER,210-224.2351,1023 N. Pine St.,,ellaaustin.org Multi-social service agency offering utility assistance to individuals and families in crisis
CLOTHING,,,,
"AGAPE MINISTRY, INC.",210-590-6655,,,theagapeministryinc.org Food Pantry & Clothes Closet
CATHOLIC CHARITIES,210-222-1294,,,ccaosa.org Clothes Closet
CHRISTIAN ASSISTANCE MINISTRY,210-697-5771,,,christianassistanceministry.org Serving individuals and families in need of assistance 5084 DeZavala
DEPAUL FAMILY CENTER,210-334-2300,7607 Somerset Rd.,,adssa.org/social-services Clothing assistance by appointment
DRESS FOR SUCCESS,210-737-1515,600 N. Frio Street,,"dfssanantonio.org Professional attire, support network, and developmental tools for women. Monday-Thursday 8:30 a.m.-4:30 p.m."
ELLA AUSTIN COMMUNITY CENTER,210-224.2351,1023 N. Pine St.,,ellaaustin.org Multi-social service agency offering clothing assistance to individuals and families in crisis.
INNER CITY DEVELOPMENT,210-224-7239,,,"innercitydevelopment.org 1300 Chihuahua Office: Monday-Friday, 9:00 a.m.-12:00 p.m. Access to groceries for families in crisis, sack lunches, and prepared bags of clothing provided to homeless individuals. Individual service hours may vary."
LITTLE CHURCH OF LA VILLITA,210-226-3593,"418 Villita St., Building 13",,"Provides free emergency food and clothing to those in need, including seniors, the disabled, and low-income families with children. Supports all of Bexar County."
OPERATION SCHOOL BELL,210-732-1200,2611 West Ave.,,Dressing students in need (K-5) in San Antonio area Title I elementary schools
PRESA COMMUNITY CENTER,210-532-5295,,,presa.org 3721 S. Presa
CAREER CLOSET,,,,"No cost, work-appropriate clothing available to men and women actively seeking employment and recently hired who need to add a few items that will make a difference."
SA HOPE CENTER,210-732-3776,,,"sahopecenter.org 321 N. General McMullen Mentorship program working to enhance the lives of working, low-income individuals and families to become food secure and increasingly sustainable on a long-term basis. Food pantry, clothing assis- tance, and emergency diaper assistance available to those that qualify. Contact for enrollment re- quirements."
SOCIETY OF ST. VINCENT DE PAUL,210-225-7837,,,svdpsa.org Direct support to our community's most vulnerable residents with clothing needs. Call for location op- tions and hours of operation.
DENTAL,,,,
CENTROMED,210-922-7000,,,"centromedsa.com (Schedule an appointment) Integrated primary care clinic that provides accessi- ble services of superior quality. Multiple locations available. Medicaid, CHIP, and private insurance accepted."
COMMUNICARE ,210-233-7000,,,"communicaresa.org Provides comprehensive dental care for children and adults. Services include preventative care and restorative care, dental disease treatments, and oral hygiene education."
EDUCATION & CAREER DEVELOPMENT,,,,
DRESS FOR SUCCESS,210-737-1515,600 N. Frio Street Developmental tools for women,,dfssanantonio.org Monday-Thursday 8:30 a.m.-4:30 p.m.
HEALY-MURPHY CENTER,210-223-2944,618 Live Oak St.,,healymurphy.org Free Texas Certification of High School Equivalency (GED) test preparation classes and case manage- ment. Class participants with high attendance are eligible for financial assistance for GED test fees. Monday-Friday: 8:00 a.m.-11:30 a.m. (Extended hours available as needed). Age requirements: Fe- males (ages 18-25; court ordered: ages 16-25); Males (ages 18-21; court ordered: ages 16-21). Call to register.
MADONNA NEIGHBORHOOD CENTER,210-432-2374,1906 Castroville Rd.,,"madonnacentersa.org In partnership with United Way, the Dual Genera- tion Initiative, works to remove barriers for families with children (ages 0-10) who are wanting to further their education and become self-sufficient. The Ma- donna Center is focusing on promoting mental health, well-being, self-efficacy and domestic vio- lence prevention."
SA YOUTH,210-223-3131,1215 W. Poplar St.,,sanantonioyouth.org Helping San Antonio’s low-income children stay in school and helping young adults who have quit school gain a second chance through high-school credit recovery and workforce training.
FINANCIAL,,,,
CATHOLIC CHARITIES,210-222-1294,,,ccaosa.org One-time emergency financial assistance
CHRISTIAN ASSISTANCE MINISTRY,210-697-5771,,,"christianassistanceministry.org Families with Proof of Residence can receive finan- cial assistance for medical prescriptions or utilities (application, ID & Social Security card required) CAM Northwest 5084 DeZavala"
DEPAUL FAMILY CENTER,210-334-2300,7607 Somerset Rd.,,adssa.org/social-services Limited monetary assistance to individuals that meet financial eligibility criteria. By appointment only.
FAMILY SERVICE ASSOCIATION	,210-431-4425,,,family-service.org
EYEGLASSES & OPTICAL,,,,
PREVENT BLINDNESS - TEXAS,210-236-7360,,,"texas.preventblindness.org 1600 NE Interstate 410, Suite 125 Financial and Housing Recovery Center offers free one-on-one financial counseling."
SOCIETY OF ST. VINCENT DE PAUL,210-225-7837,,,svdpsa.org Family and Community Assistance Program offers limited financial assistance is provided for expenses such as rent to very low-income individuals that qualify.
FOOD & GROCERIES,,,,
"AGAPE MINISTRY, INC.",210-590-6655,,,theagapeministryinc.org Food Pantry
ALAMO CENTER EDUCATION & TREATMENT,210-824-5537,5018 San Pedro,,alamocenter.org The Alamo Center Neighborhood Food Pantry is free and available to anyone in need of food assis- tance. Completion of intake form required prior to food distribution. Monday-Friday: 10:00 a.m.-3:00 p.m.
ANTIOCH BAPTIST CHURCH,210-225-2452,1001 N. Walters St.,,antiochsat.org/food-bank Food bank ministry
CATHOLIC CHARITIES,210-222-1294,,,ccaosa.org
ST. STEVEN'S CARE CENTER,210-226-6178,(Schedule an appointment) 2127 S. Zarzamora St.,,Monday-Friday: 8:30 a.m.-5:00 p.m.
GUADALUPE COMMUNITY CENTER 210-226-6178,,1801 Cesar Chavez,,"SNAP Assistance, Project Hope – First Monday of every month, low-income seniors can receive food"
CATHOLIC WORKER HOUSE,210-224-7736,"Safe haven for homeless seniors (ages 50+) with access to meals, gardening, laundry facilities, phone, email, games and movies. (Limited services provided on Fridays in the courtyard.) Monday- Thursday: 8:00 a.m.-1:00 p.m., Friday: 9:00 a.m.- 10:30 a.m.",,sa-catholicworker.org 626 Nolan
CHRISTIAN ASSISTANCE MINISTRY,210-223-4099,110 McCullough Ave,,"christianassistanceministry.org Serving individuals and families in need of assis- tance CAM Downtown Sack lunches provided to homeless, eligible fami- lies with proof of residence can receive groceries. Hours: Monday-Thursday: 9:30 a.m.-3:00 p.m., Fri- day: 9:30 a.m.-11:30 a.m. (Services may have spe- cific hours of availability.) CAM Northwest 210-697-5771 5084 DeZavala Sack lunches, Monday-Thursday 9:00 a.m.-2:00 p.m."
CORAZON SAN ANTONIO,210.226.8341,,,corazonsa.org  x318
DAY CENTER & RESOURCE HUB,,504 Avenue E,,"Monday-Friday: 11:00 a.m.-5:00 p.m. (Lunch served at noon.) Warm meal, Showers, ID Recovery, Street Outreach, Case Management"
DEPAUL FAMILY CENTER,210-334-2300,7607 Somerset Rd.,,"adssa.org/social-services Food assistance through our in-house food pantry, free groceries to financially eligible individuals (ages 60+). By appointment only."
ELLA AUSTIN COMMUNITY CENTER,210-224.2351,1023 N. Pine St.,,"ellaaustin.org Multi-social service agency offering assistance to individuals and families in crisis of food, clothing, and utilities assistance, senior nutrition, senior activ- ities and volunteer income tax assistance programs."
INMAN CHRISTIAN CENTER,210-222-9641,1214 Colima Street,,inmancenter.org Neighborhood-based community center serving the needs of low-income individuals and families in the inner city of San Antonio including emergency food assistance
INNER CITY DEVELOPMENT,210-224-7239,,,"innercitydevelopment.org 1300 Chihuahua Office: Monday-Friday, 9:00 a.m.-12:00 p.m. Access to groceries for families in crisis, sack lunch- es and prepared bags of clothing provided to homeless individuals. Individual service hours may vary."
LITTLE CHURCH OF LA VILLITA,210-226-3593,"418 Villita St., Building 13",,"Provides free emergency food and clothing to those in need, including seniors, the disabled, and low-income families with children."
MEAL ON WHEELS,210-735-5115,,,"mowsatx.org Free nutritious meals delivered each weekday to eligible senior and disabled individuals with an aim to eliminate hunger, alleviate isolation, and foster independence among seniors"
METROPOLITAN COMMUNITY CHURCH,210-472-3597,611 E Myrtle Street,,mccofsanantonio.com/foodpantry Food Pantry Hours: Saturdays following the 1st and 3rd Thursday of each month (8:00 a.m.-12:00 p.m.). Emergency food distribution is available Monday- Friday by appointment only.
SA HOPE CENTER,210-732-3776,,,"sahopecenter.org 321 N. General McMullen Mentorship program working to enhance the lives of working, low-income individuals and families to become food secure and increasingly sustainable on a long-term basis. Food pantry, clothing assis- tance, and emergency diaper assistance available to those that qualify. Contact for enrollment re- quirements."
SALVATION ARMY,210-352-2020,,,salvationarmysanantonio.org 910 N. Flores
SAN ANTONIO FOOD BANK,210-431-8326,,,"safoodbank.org Assistance with SNAP & other benefits applications, as well as finding immediate food assistance and job training opportunities. Find Food: freshtrak.com"
SENIOR NUTRITION PROGRAM,210-207-7172,,,"sanantonio.gov Provides senior adults (ages 60+) and their spouses, in Bexar County, with a free nutritionally balanced lunchtime meal in a congregate setting with sup- portive services. Call for center locations and addi- tional program information. Monday-Friday: 9:00 a.m.-1:00 p.m."
SOCIETY OF ST. VINCENT DE PAUL,210-225-7837,,,svdpsa.org Direct support to our community's most vulnerable residents with essential food needs. Call for location options and hours of operation.
LAUNDRY,,,,
CATHOLIC WORKER HOUSE,210-224-7736,"Safe haven for homeless individuals (age 50+) with access to meals, gardening, laundry facilities, phone, email, games and movies. (Limited services provided on Fridays in the courtyard.) Monday- Thursday: 8:00 a.m.-1:00 p.m., Friday: 9:00 a.m.- 10:30 a.m.",,sa-catholicworker.org 626 Nolan
LEGAL,,,,
BEXAR COUNTY GUARDIANSHIP PROGRAM,210-335-3744,,,"233 N. Pecos, Suite 320-G Guardianship is a legal process utilized when a per- son can no longer make or communicate safe or sound decisions. Call to discuss referral."
EQUAL JUSTICE CENTER,210-308-6222,,,"equaljusticecenter.org Nonprofit organization that provides legal assis- tance to qualified, low-income individuals on the topics of workplace rights and rights to work."
DACA APPLICATIONS 888-670-6854,,,,Assistance with preparation and submission of De- ferred Action for Childhood Arrivals (DACA) appli- cation.
TEXAS RIOGRANDE LEGAL AID,833-329-8752,,,"trla.org Provides free legal counsel, representation, and ed- ucational services to people with low-income in 68 Texas counties. Monday-Friday: 9:00 a.m.-5:00 p.m."
DRIVER'S LICENSE RESTORATION CLINIC,,1 Haven for Hope Way,,Serves homeless and low-income veterans. Staff work to remove barriers to obtaining driver's licens- es. At 1:30 p.m. every Friday; appointments encour- aged.
LEGAL AID FOR VETERANS,,,,"Audie L. Murphy Hospital (Rec. Room) 7400 Merton Minter Serves low-income veterans and direct dependents with legal issues related to housing, foreclosure, veterans benefits, SNAP/TANF, family law, Social Security benefits, Medicaid/Medicare/CHIP, con- sumer law, and other legal issues. First Wednesday of the month; 9:00 a.m.-12:00 p.m."
TRANSPORTATION,,,,
PRESA COMMUNITY CENTER,210-532-5554,Transportation services for those who are unable to drive or use public transportation. Eligible individu- als (ages 60+) and individuals currently disabled. $5 per trip/ $10 round trip. Rides available Monday- Friday.,,presa.org 3721 S. Presa (Schedule at least two weeks in advance.)
