name,phone,address,website,description
VIA BUS,210-362-2020,,,"viainfo.net Reduced rates are available for qualifying students, seniors, children, disabled, veteran, U.S. miliary, or Medicare recipients."
BUS ROUTING & SCHEDULING 210-362-2020,,Monday-Friday: 6:00 a.m.-10:00 p.m. Saturday: 7:00 a.m.-7:00 p.m.,,Sunday: 8:00 a.m.-5:00 p.m.
CENTRO PLAZA 210-299-5802,,909 W. Houston St.,,"Monday-Friday: 8:00 a.m.-1:00 p.m., 2:30 p.m.-5:00 p.m."
ELLIS ALLEY INFORMATION CENTER 210-299-1213,,212 Chestnut St.,,"Monday-Friday: 8:00 a.m.-1:00 p.m., 2:30 p.m.-5:00 p.m."
VIA METRO CENTER 210-362-2006,,1021 San Pedro,,Monday-Friday: 8:00 a.m.-5:00 p.m.
MISCELLANEOUS,,,,
CORAZON SAN ANTONIO,210.226.8341,,,corazonsa.org x318
DAY CENTER & RESOURCE HUB,,504 Avenue E,,"Monday-Friday: 11:00 a.m.-5:00 p.m. (Lunch served at noon.) Warm meal, Showers, ID Recovery, Street Outreach, Case Management"
MEDICAL CENTER,,,,230 E. Travis This clinic is 100% free and offers some pharmaceu- tical needs. Sunday: 8:00 a.m.-11:30 a.m. Wednesday: 4:30 p.m.-6:30 p.m.
DEPAUL FAMILY CENTER,210-334-2300,7607 Somerset Rd.,,"adssa.org/social-services Help navigating public assistance programs (i.e. Medicare, Medicaid, SSI, Care Link, food stamps and child care). By appointment only."
ELLA AUSTIN COMMUNITY CENTER,210-224.2351,1023 N. Pine St.,,"ellaaustin.org Multi-social service agency offering affordable day care, parenting classes, youth and family services including after school and summer youth programs, assistance to individuals and families in crisis of food, clothing, and utilities assistance, senior nutri- tion, senior activities and volunteer income tax as- sistance programs."
FAMILY SERVICE ASSOCIATION	,210-299-2400,,,family-service.org
MARGRET’S PLACE,,,,"Emergency Pantry providing access to basic items, such as soap, deodorant, diapers, and school sup- plies."
PROJECT MEND,210-223-6363,5015 Wurzbach Road,,"projectmend.org Transforming lives through medical equipment reuse such as walk- ers, shower chairs, and canes."
UNITED WAY,,"Uniting people to address our community’s most complex issues. 211 is a free, anonymous social service hotline that helps people find information about local resources in their community.",,uwsatx.org 211
DEAF & HARD OF HEARING,,,,
DEAF COUNSELING CENTER,240-380-2577,,,"deafcounseling.com (Videophone) Deaf-owned and operated therapy, counseling, coaching, assess- ments and psychiatric and consulting practice staffed by Deaf li- censed professional therapists."
NATIONAL DEAF THERAPY $,,,,nationaldeaftherapy.com Full-service mental health support for the deaf community offering American Sign Language (ASL) therapy sessions
DOMESTIC VIOLENCE,,,,
BEXAR COUNTY FAMILY JUSTICE CENTER ,210-631-0100,,,"bcfjc.org 1- 126 E. Nueva, 2nd Floor Coordinated services for victims of domestic and family violence in- cluding Criminal Justice Intervention, Civil Legal Services, Child Care, Counseling Services, and Life Skills"
FAMILY VIOLENCE PREVENTION SERVICES,210-930-3669,7911 Broadway,,"fvps.org Offers residential and non-residential clients shelter, transitional housing, counseling for adults, children, families, and legal services. These services help individuals and families recovery from the pain and longer-term effects of domestic violence."
MAGDALENA HOUSE,210-561-0505,,,"maghouse.org Transitional homes in San Antonio that serves mothers and their chil- dren who have fled dangerous and abusive lives. Utilizing a dual- generation approach, we provide safe shelter, basic needs, educa- tional programming, and therapeutic services."
TEXAS ADVOCACY PROJECT,800-374-4673,,,"texasadvocacyproject.org Free legal services and access to the justice system for domestic violence survivors. Provides advice over the phone, support with do-it-yourself legal filing processes, and complete client representa- tion."
WOMENSLAW,,,,"womenslaw.org Legal resources for victims of abuse, and an Email Hotline providing information related to domestic violence, sexual assault, or stalking."
FIRST RESPONDERS,,,,
FIRST RESPONDER BEHAVIORAL HEALTH TRAINING,713-500-3599,,,"uthealth.catalog.instructure.com/browse/heroes Free, research-based courses providing first re- sponders across Texas with the tools and infor- mation necessary to recognize and address symp- toms of substance use and mental health disorders in themselves or others. Courses are provided by UTHealth Houston and are available to any career or volunteer first responder (law enforcement of- ficer, firefighter, dispatcher, EMT, paramedic), ac- tive or retired, in Texas."
TEXAS LAW ENFORCEMENT PEER NETWORK,972-338-1314,,,"untdallas.edu/cpi/tlepn Free program designed to give every Texas law en- forcement officer access to a specially trained peer to address stressors, trauma, fatigue, and other needs to combat workforce burnout and end police suicide and self-harm."
HIV/AIDS CARE,,,,
ALAMO AREA RESOURCE CENTER,210-625-7200,,,"aarcsa.com 303 N. Frio Alamo Area Resource Center (AARC) provides short -term rental, mortgage and utility assistance (STRMU), tenant-based rental assistance (TBRA), and housing case management for people living with HIV."
SAN ANTONIO AIDS FOUNDATION,210-225-4715,,,sanantonioaids.org 818 E. Grayson
CARSON HOUSE,,,,"Transitional housing for homeless men, women, and transgender individuals living with HIV/AIDS. Residents pay 30% of their adjusted gross monthly income in rent on the 5th of every month."
INTELLECTUAL &,,,,
DEVELOPMENTAL DISABILITIES,,,,
ALAMO AREA COUNCIL OF GOVERNMENTS,210-832-5020,,,"Operates as the local intellectual and developmen- tal disability authority for Bexar County aacog.com/IDDServices 2700 NE Loop 410, Suite 101 Operates as the local intellectual and developmen- tal disability authority for Bexar County providing service coordination for individuals with intellectual & developmental disability (IDD)."
CENTER FOR HEALTHCARE SERVICES	,210-261-2427,,,"chcsbc.org People living with IDD deserve to live life to its full- est, and may require long-term services and sup- ports indefinitely. By promoting dignity and choice for adults with IDD, the CHCS Long-Term Care Ser- vices help improve the quality of life for consumers and their loved ones through programs designed for inclusivity, accessibility, and independence."
THE ARC OF SAN ANTONIO,210-490-4300,,,arc-sa.org The Arc of San Antonio serves as a social service home in Bexar and surrounding counties to children and adults with intellectual and developmental dis- abilities (IDD) and assists their families during all phases of life.
CALIDAD ,,227 W. Drexel,,
DAY HABILITATION 210-261-3706,,,,"Activities to help intellectually disabled individuals become more independent in daily and personal skills. Provides assistance with acquiring, retaining, or improving self-help, socialization, and adaptive skills necessary to live successfully in the community and to participate in home and community life."
EMPLOYMENT CONNECTIONS 210-261-3419,,,,"The employment team provides assistance in attain- ing and sustaining competitive, integrated employ- ment in the community to include résumé building, interviewing skills, job placement and job coaching to all Bexar County residents with disabilities."
EISENHAUER GROUP HOME $,210-261-3419,2927 Eisenhauer Road,,"10-bed group home for individuals with an intellec- tual or developmental disability. Facility provides 24 -hour residential services for individuals who do not live independently or with their natural family. In- cludes meals, medication management, transporta- tion, living skills, leisure/recreational activities and support."
HOME & COMMUNITY-BASED SERVICES $,210-261-3419,,,"Medicaid Waiver Program that provides services to people of all ages with an intellectual or develop- mental disability, related condition, or both, who live with their families or in their own home. To maintain optimal quality of life, we provide services to help with needs related to daily living, independ- ent living and leisure/recreational activities."
MULTI-ASSISTANCE CENTER (MAC),210-817-3935,5210 Thousand Oaks Dr.,,morganswonderlandmac.com Community Center for Individuals with Disabilities and Special Needs that provides comprehensive and coordinated services.
PREGNANCY,,,,
CASA MIA,210-549-4730,,,casamiasanantonio.com Recovery home helping pregnant and parenting women who are recovering from opioid use disor- ders prioritizing keeping families together.
CATHOLIC CHARITIES,,,,ccaosa.org
GUADALUPE HOME 210-476-0707,,,,"Transitional shelter for pregnant and parenting mothers and their babies who find themselves homeless and are interested in making a change for a hopeful future through full-time education enroll- ment or employment. Case management, parenting education, life skills training, and counseling are provided."
DEPAUL FAMILY CENTER,210-334-2300,7607 Somerset Rd.,,adssa.org/social-services
REALIZING & ACHIEVING YOUR SUCCESS (RAYS),,"Program for individuals that are pregnant or have a child (age 36 months or younger). Program pro- vides material assistance, counseling, classes and guidance.",,
GEORGE GERVIN YOUTH CENTER: BASIC CENTER,210-568-8800,6944 South Sunbelt Drive,,"Pregnant, homeless, and/or runaway individuals (ages 13-17) looking to continue their education in a safe and supportive environment. The Basic Pro- gram provides therapeutic and supportive services and acts as a short- and long-term residential care facility to those whose needs are not adequately met in their current family structure or other shel- ters."
SETON HOME,210-533-3504,1115 Mission Rd.,,"setonhomesa.org Long-term residential program as well as an emer- gency shelter for pregnant and parenting teen mothers and their children in order to break the cy- cle of abuse and poverty by providing a caring home, education, and support services."
VETERANS,,,,
ALAMO COMMUNITY GROUP,210-731-8030,"4606 Centerview Drive, Suite 170",,alamocommunitygroup.org
HOUSE OUR HEROES PROGRAM 210-699-9074,,,,Quality affordable housing and extensive support- ive services to include outreach and case manage- ment to homeless and at-risk veteran families.
BEXAR COUNTY MILITARY AND VETERANS SER-,,,,
VICES CENTER,210-335-6775,"1422 E. Grayson St., 4th Floor",,"bexar.org/509/Military-and-Veterans-Services- Center The Bexar County Military and Veterans Services Center is your advocate, and we can assist and sup- port you with your Veteran Affairs benefit claim fil- ing and provide you vetted resources and assis- tance with eligible VA benefits."
THE ECUMENICAL CENTER	,210-616-0885,8310 Ewing Halsell Drive (Headquarters),,ecrh.org
MILITARY AND VETERAN SUPPORT GROUPS,,,,"510 Belknap Place Endeavors supports the lives and well-being of Vet- erans, active duty service members, and military families, regardless of role while in uniform, dis- charge status, or combat experience by providing tools and services such as free and low-cost coun- seling, mental health support, life skills courses, fit- ness classes, case management, and more. Current groups: Survivors of Loved Ones’ Suicides (SOLOS) and Life After Loss: Grief/Bereavement Support Group. Call for scheduling and enrollment."
HAVEN FOR HOPE	,210-220-2100,1 Haven For Hope Way,,havenforhope.org Haven for Hope’s Veteran’s Service team works with veterans experiencing homelessness beyond their immediate shelter needs. We help them establish Social Security disability and Veterans Affairs bene- fits and apply for other federal and state resources that can greatly improve their quality of life. Intake hours are Monday-Friday: 7:00 a.m.-3:00 p.m.
LAUREL RIDGE TREATMENT CENTER ,210-491-9400,17720 Corporate Woods Drive,,"laurelridgetc.com Our mental health treatment center is proud to sup- port the military and their families. If you are a mili- tary member, we offer specific programs for you, including military trauma programs, military sub- stance abuse programs and more."
NATIONAL VETERANS OUTREACH PROGRAM,210-223-4088,,,agif-nvop.org
VETERANS SERVICE CENTER SAN ANTONIO 210-354-4892,,,,"611 N. Flores, Suite 200 Employment Assistance for Veterans and Homeless Civilians, Housing Intake"
RESIDENTIAL CENTER FOR HOMELESS VETERANS,210-354-4892,"80-bed facility dedicated to the needs of America’s warriors who have been living on the streets. Ser- vices include case management, employment assis- tance, housing assistance, counseling groups, sub- stance use treatment, on-site gym, three meals dai- ly, on-site computer labs, and shuttle services to ap- pointments and job interviews (available by ap- pointment).",,(Request Intake) 519 N. Medina
VETERAN HOUSING AND COUNSELING 210-233-8505,210-617-5300,"206 San Pedro, Suite 200",,"Services that assist very low-income veteran families in obtaining permanent housing. No-cost mental health services provided to Veterans and their local family members. SOUTH TEXAS VETERANS HEALTH CARE SYSTEM  va.gov/south-texas-health-care If you’re struggling with issues like PTSD, depres- sion, grief, anger or trauma, we offer counseling and other support. All VA health care facilities offer same-day help. You may qualify even without enrol- ling in VA health care. Service options include Inpa- tient Hospitalization, Individual Therapy, Group Therapy, Case Management, Medication Manage- ment, Intensive Outpatient Program, Crisis"
TEXAS RIOGRANDE LEGAL AID,833-329-8752,,,trla.org
DRIVER'S LICENSE RESTORATION CLINIC,,1 Haven for Hope Way,,Assists low-income veterans with removing barriers to obtaining driver's licenses. At 1:30 p.m. every Friday; appointments encouraged.
LEGAL AID FOR VETERANS,,,,"Audie L. Murphy Hospital Rec. Rm 7400 Merton Minter Serves low-income veterans and direct dependents with legal issues related to housing, foreclosure, veterans benefits, SNAP/TANF, family law, Social Security benefits, Medicaid/Medicare/CHIP, con- sumer law, and other legal issues. First Wednesday of the month; 9:00 a.m.-12:00 p.m."
VIA BUS,210-362-2020,,,viainfo.net Reduced rates are available for qualifying veteran and U.S. miliary. EACH ONE OF US CAN MAKE A DIFFERENCE. TOGETHER WE CAN MAKE A CHANGE. Barbara Mikulski
BEXAR COUNTY,,,,
DEPARTMENT OF BEHAVIORAL HEALTH,,,,Visit the Department of Behavioral Health website or scan the QR code  Subscribe for Local Behavioral Health Updates Submit Questions and Comments Submit Your Agency for the Directory
